name,id,tier,rarity,tech/manufacturer,tags,uiTags,base value,unlocked,hidden,hiddenEverywhere,cost_frigate,cost_dest,cost_cruiser,cost_capital,script,desc,short,sModDesc,sprite
Cutting Edge Integrated Sensor Gride,zenithia_cutting_edge_integrated_sensor_gride,,,Domain Explorium,,,,,TRUE,,0,0,0,0,data.hullmods.zenithia_cutting_edge_integrated_sensor_gride,"This ship has a cutting edge integrated sensor gride, greatly increaseing sensor range by %s, the high energy emissions from the grid increase sensor profile by %s.",,,graphics/hullmods/zenithia_cutting_edge_integrated_sensor_gride.png
Advanced Orbital Surveying Suite,zenithia_advanced_orbital_surveying_suite,,,Domain Explorium,,,,,TRUE,,0,0,0,0,data.hullmods.zenithia_advanced_orbital_surveying_suite,"This ship has an advanced orbital survying suite, reducing the heavy machinery and supplies required to perform surveys by %s down to a minimum of %s for each.",Reduces resource requirements for surveying.,Increases the survey cost reduction by %s.,graphics/hullmods/zenithia_advanced_orbital_surveying_suite.png
Domain Explorium Grade Hull,zenithia_domain explorium grade hull,,,Domain Explorium,,,,,TRUE,,0,0,0,0,data.hullmods.zenithia_domain_explorium_grade_hull,"This ship was designed and manufactuered to the stringent speciel requirments of the Domain of Man Explorium, greatly strengthing the vessel's hull by %s, reducing crew casualties by %s, while increasing the protection from solar coronae and similar hazards to %s, the protection from high energy impacts give it %s reduction to energy damage, furthermore extensive automated maintance and repair systems imbedded in the hull reduce the time required to repair disabled weapons and engines (in combat) by %s.",,,graphics/hullmods/zenithia_domain_explorium_grade_hull.png
Advanced Central Computing Core,zenithia_advanced_central_computing_core,,,Domain,,,,,TRUE,,0,0,0,0,data.hullmods.zenithia_advanced_central_computing_core,"This ship has a advanced central computing core, a massive general purpese computing center used for a varity of tasks, often paired with advanced sensor systems they can among many things increase the non-missile weapon range of a vessel by %s including point defence armanants, while improving accuarcy and recoil through automated control adjustments",,,graphics/hullmods/zenithia_advanced_central_computing_core.png
,,,,,,,,,,,,,,,,,,,
